{
  "$schema": "https://json-schema.org/draft/2020-12/schema",
  "title": "ARENA extension verification report",
  "type": "object",
  "additionalProperties": true,
  "required": [
    "notebook_id",
    "date_run",
    "git_commit",
    "report_inputs",
    "gt_tier",
    "evidence_level",
    "claim_scope",
    "gpu_name",
    "peak_vram_gb",
    "wall_clock_seconds",
    "models",
    "datasets",
    "tests_passed",
    "metrics",
    "baselines",
    "negative_controls",
    "ood_tests",
    "known_failures",
    "safety_notes",
    "accepted"
  ],
  "properties": {
    "notebook_id": {"const": "7_4_mini_natural_language_autoencoders"},
    "date_run": {"type": "string"},
    "git_commit": {"type": "string"},
    "report_inputs": {
      "type": "object",
      "required": ["schema_version", "algorithm", "combined_sha256", "files"],
      "properties": {
        "schema_version": {"const": 1, "type": "integer"},
        "algorithm": {"const": "sha256", "type": "string"},
        "combined_sha256": {"type": "string"},
        "files": {"type": "array", "minItems": 1, "items": {"type": "object"}}
      }
    },
    "gt_tier": {"const": "GT-3"},
    "evidence_level": {"type": "string"},
    "claim_scope": {"type": "string"},
    "gpu_name": {"type": "string"},
    "peak_vram_gb": {"type": "number", "minimum": 0, "maximum": 24},
    "wall_clock_seconds": {"type": "number", "minimum": 0},
    "models": {"type": "array"},
    "datasets": {"type": "array"},
    "tests_passed": {"type": "boolean"},
    "metrics": {"type": "object"},
    "baselines": {"type": "object"},
    "negative_controls": {"type": "object"},
    "ood_tests": {"type": "object"},
    "known_failures": {"type": "array"},
    "safety_notes": {"type": "array"},
    "accepted": {"type": "boolean"}
  }
}
